,titles,content,url
66,Factbox: German to pass energy laws before parliament breaks for summer - Reuters,"July 7 (Reuters) - Germany's lower house of parliament, the Bundestag, on Thursday is due to decide on two laws to deal with energy emergency issues stemming from a fall in Russian energy supplies am… [+1967 chars]",https://www.reuters.com/business/energy/german-pass-energy-laws-before-parliament-breaks-summer-2022-07-07/
67,UK PM Johnson says it wouldn't be responsible to resign now - Reuters UK,"LONDON, July 6 (Reuters) - British Prime Minister Boris Johnson defied further calls for him to step down amid a wave of government resignations, arguing it wouldn't ""responsible"" for him to quit rig… [+506 chars]",https://www.reuters.com/world/uk/uk-pm-johnson-says-it-wouldnt-be-responsible-resign-now-2022-07-06/
68,"World hunger rising as U.N. agencies warn of ""looming catastrophe"" - Reuters","LONDON, July 6 (Reuters) - World hunger levels rose again last year after soaring in 2020 due to the COVID-19 pandemic, with the Ukraine war and climate change threatening starvation and mass migrati… [+2754 chars]",https://www.reuters.com/world/world-hunger-rising-un-agencies-warn-looming-catastrophe-2022-07-06/
69,Europe on edge as Nord Stream Russian gas link set for planned shut-down - Reuters.com,"LONDON/FRANKFURT, July 11 (Reuters) - The biggest single pipeline carrying Russian gas to Germany starts annual maintenance on Monday, with flows expected to stop for ten days, but governments, marke… [+5690 chars]",https://www.reuters.com/business/energy/europe-edge-nord-stream-russian-gas-link-set-planned-shut-down-2022-07-10/
70,Israel to examine reports of decades-old grave for buried Egyptian soldiers - Reuters.com,"JERUSALEM, July 10 (Reuters) - Israeli Prime Minister Yair Lapid said on Sunday that his office would investigate reports of a mass grave in central Israel containing the bodies of Egyptian commandos… [+1233 chars]",https://www.reuters.com/world/middle-east/israel-examine-reports-decades-old-grave-buried-egyptian-soldiers-2022-07-10/
71,Poland asks Ukraine to confront dark past despite common front against Moscow - Reuters.com,"WARSAW, July 11 (Reuters) - Poland's president on Monday called for Ukraine to admit what he called the shameful truth about how Ukrainian nationalists had massacred over 100,000 Poles during World W… [+2610 chars]",https://www.reuters.com/world/europe/poland-asks-ukraine-confront-dark-past-despite-common-front-against-moscow-2022-07-11/
72,14 firms to get oil from U.S. strategic reserve in latest sale - Reuters.com,July 11 (Reuters) - The United States on Monday said 14 companies had been awarded contracts for the latest sale of oil from the Strategic Petroleum Reserve as part of the administration's efforts to… [+542 chars],https://www.reuters.com/business/energy/14-firms-get-oil-us-strategic-reserve-latest-sale-2022-07-11/
73,Germany’s Chancellor Promised to Deter Putin. Then He Did Nothing.,"Its a concern all allies of Ukraine share, of course. But only Germany seems to have been transfixed by it. Yet the reason for the governments reluctance to furnish Ukraine with the support it needs … [+2201 chars]",https://www.nytimes.com/2022/06/14/opinion/germany-scholz-russia-ukraine.html
74,Putin says Russia has not 'started anything in earnest' with regard to its war with Ukraine,"Russian President Vladimir Putin has warned that Russia is just getting started in its war with Ukraine, despite the conflict dragging on for over 130 days and Moscow's forces suffering heavy casualt… [+1662 chars]",https://www.businessinsider.com/putin-says-russia-is-just-getting-started-in-ukraine-2022-7
75,"Record number of people worldwide are moving toward starvation, U.N. warns","Sergei, 11, waits his turn to receive donated food during an aid humanitarian distribution in Bucha, in the outskirts of Kyiv, on Tuesday, April 19, 2022.
Emilio Morenatti/AP
UNITED NATIONS The spi… [+5485 chars]",https://www.npr.org/2022/07/07/1110219180/record-number-of-people-worldwide-are-moving-toward-starvation-u-n-warns
76,Russia-Ukraine war: what we know on day 113 of the invasion,"<li>Ukraine has so far defied a Russian ultimatum to surrender Sievierodonetsk, with Moscow controlling 80% of the city, a focal point of Russias advances in the east of the country.Russia demanded U… [+4490 chars]",https://amp.theguardian.com/world/2022/jun/16/russia-ukraine-war-what-we-know-on-day-113-of-the-invasion
77,"Shredded trees, dead dolphins and wildfires — how Russia's invasion is hurting nature","Viktor Radushinskiy, a member of Ukraine's forestry department in Zhytomyr, looks at a site in the northern Ukrainian woods where a fighter jet crashed.
Claire Harbage/NPR
ZHYTOMYR, Ukraine When th… [+12318 chars]",https://www.npr.org/2022/07/01/1106327585/russia-invasion-ukraine-environment-impacts
78,"Foreign fighters in Ukraine, many in motley groups, face perils if captured.","Mr. Magrou, a corporal in the legions structure, said accepted volunteers are now required to have combat experience, no records of dishonorable behavior, and no membership in extremist groups. Other… [+1687 chars]",https://www.nytimes.com/2022/06/17/world/europe/foreign-fighters-ukraine-americans.html
79,Made in America: these are some of the companies bringing manufacturing back to the US,"American manufacturers are increasingly bringing production back to the US to reduce their reliance on global supply chains that proved vulnerable to disruption such as the pandemic. 
An overwhelmin… [+2969 chars]",https://www.businessinsider.com/made-in-america-companies-bringing-manufacturing-back-to-us-2022-7
80,Great Britain will stop supplying gas to mainland Europe if hit by shortages,"Great Britain plans to stop supplying gas to mainland Europe if the country is hit by extreme shortages in the coming months, it has emerged.
National Grid could cut off gas pipelines to the Netherl… [+2652 chars]",https://amp.theguardian.com/business/2022/jun/29/great-britain-will-stop-supplying-gas-to-mainland-europe-if-hit-by-shortages-national-grid
81,Tensions heighten in Taiwan Strait as China acts to extend military operations,"Chinas president, Xi Jinping, has signed legal orders allowing a trial of military operations beyond Chinas borders amid heightened tensions over claims by Chinas foreign ministry that the Taiwan Str… [+4948 chars]",https://amp.theguardian.com/world/2022/jun/15/tensions-heighten-in-taiwan-strait-as-china-acts-to-extend-military-operations
82,Russia-Ukraine war: three killed in blasts in Russian city near Ukraine border – latest updates,"An adviser to President Volodymyr Zelenskiy has conceded Lysychansk could fall, as fighting intensified in Ukraines last big bastion in the strategic eastern province of Luhansk.Oleksiy Arestovych sa… [+627 chars]",https://www.theguardian.com/world/live/2022/jul/03/russia-ukraine-war-three-killed-in-blasts-in-russian-city-near-ukraine-border-latest-updates
83,"US authorities stopped a tanker full of Russian oil products on its way to New Orleans, report says","US authorities stopped a ship loaded with Russian oil products on its way to Louisiana, sources told the Wall Street Journal reported Tuesday.
The ship departed in early June from the Taman peninsul… [+2047 chars]",https://markets.businessinsider.com/news/commodities/russian-oil-fuel-tanker-new-orleans-us-embargo-ukraine-sanctions-2022-6
84,Quant-investing pioneer Jim Simons predicts Warren Buffett's old-school approach will stay relevant — and lays out the 5 key principles he lives by,"Jim Simons discussed why his hedge fund employs scientists instead of bankers, defended Warren Buffett's relevance in an age of supercomputers and algorithmic trading, and shared the five principles … [+2162 chars]",https://markets.businessinsider.com/news/stocks/jim-simons-rentech-quant-hiring-warren-buffett-investing-style-principles-2022-6
85,"The Latest on U.S. State Abortion Laws, Blocks and Bans","A tug of war over the future of abortion access is playing out in courts across the United States after the Supreme Court overturned Roe v. Wade, adding to a legal landscape defined by uncertainty, c… [+422 chars]",https://www.nytimes.com/2022/07/01/us/abortion-bans-laws-blocked-us-states.html
86,Boris Johnson said Putin wouldn't have started the war in Ukraine if he were a woman,"British Prime Minister Boris Johnson claimed on Tuesday that the Ukraine war might not have happened if Russian President Vladimir Putin had been a woman, condemning the invasion as an act of ""toxic … [+1213 chars]",https://www.businessinsider.com/boris-johnson-putin-woman-war-ukraine-wouldnt-invade-2022-6
87,"Global natural gas demand is expected to decline over the next three years as prices soar, according to the IEA","The surge in natural gas prices over the last year is prompting countries to turn to dirtier sources of fuel, despite their environmental commitments, and will utimately bring about a drop in demand … [+2371 chars]",https://markets.businessinsider.com/news/commodities/natural-gas-global-demand-destruction-next-three-years-iea-2022-7
88,"A YouTuber journalist visiting a rebranded McDonald's in Russia says the air smells different, the buns aren't the same, and the Coke is flatter and not as sweet as the original","A Russian reporter from a popular YouTube channel went to the rebranded McDonald's in Moscow and said the smell and food are different.
McDonald's was among the American chains that closed operation… [+3101 chars]",https://www.businessinsider.com/reporter-russia-says-rebranded-mcdonalds-smells-and-tastes-different-2022-6
89,Global nuclear arsenal to grow for first time since Cold War - think-tank - Reuters,"STOCKHOLM, June 13 (Reuters) - The global nuclear arsenal is expected to grow in the coming years for the first time since the Cold War while the risk of such weapons being used is the greatest in de… [+2330 chars]",https://www.reuters.com/world/global-nuclear-arsenal-grow-first-time-since-cold-war-think-tank-2022-06-12/
90,"China attack on Taiwan would hit global trade more than Ukraine war, says Taiwan - Reuters.com","GENEVA, June 14 (Reuters) - Any Chinese military attack on Taiwan would have a greater impact on global trade flows than the Ukraine war, Taipei's top trade negotiator told Reuters on Tuesday, saying… [+2521 chars]",https://www.reuters.com/world/asia-pacific/china-attack-taiwan-would-hit-global-trade-more-than-ukraine-war-says-taiwan-2022-06-14/
91,"Pope Francis says he refuses distinction between ""good and bad"" in Ukraine war - papers - Reuters.com","ROME, June 14 (Reuters) - Pope Francis refused the distinction between ""good and bad"" in the war in Ukraine, he was quoted as saying by daily La Stampa, which reported Pope's conversation with editor… [+505 chars]",https://www.reuters.com/world/europe/pope-francis-says-he-refuses-distinction-between-good-bad-ukraine-war-papers-2022-06-14/
92,ICC prosecutor aims to show war criminals can't escape justice - Reuters,"KYIV, June 16 (Reuters) - The chief prosecutor of the International Criminal Court said on Thursday he hoped his war crimes investigation in Ukraine would show there can be no escape from justice dur… [+2106 chars]",https://www.reuters.com/legal/government/icc-prosecutor-aims-show-war-criminals-cant-escape-justice-2022-06-16/
93,"As war in east rages on, Ukraine gets chance to 'live the European dream' - Reuters","BRUSSELS/KYIV, June 18 (Reuters) - With the war in Ukraine's east raging on, Kyiv received a major boost when the European Union recommended that it become a candidate to join the bloc, in what would… [+5768 chars]",https://www.reuters.com/world/europe/wrapup1-war-east-rages-ukraine-gets-chance-live-european-dream-2022-06-18/
94,U.S. senators press TikTok on whether it allows Russian 'pro-war propaganda' - Reuters,"WASHINGTON/NEW YORK, June 17 (Reuters) - Republican senators on Friday asked TikTok Chief Executive Shou Zi Chew about reports the social media site had allowed Russian state-approved media content b… [+2458 chars]",https://www.reuters.com/business/media-telecom/us-senators-press-tiktok-whether-it-allows-russian-pro-war-propaganda-2022-06-17/
95,UK set to step in to host next Eurovision due to war in Ukraine - Reuters,"LONDON, June 17 (Reuters) - The Eurovision Song Contest is likely to be held in Britain in 2023 as the organisers deem it too risky for this year's winners Ukraine to host it due to the war, drawing … [+2168 chars]",https://www.reuters.com/lifestyle/uk-set-step-host-next-eurovision-due-war-ukraine-2022-06-17/
96,Ukraine will need to start debt servicing talks if war drags on - presidential adviser - Reuters,"KYIV, June 20 (Reuters) - Ukraine will have to start discussions with creditors on external debt restructuring if the war with Russia continues for a long time, presidential economic adviser Oleh Ust… [+647 chars]",https://www.reuters.com/world/europe/ukraine-will-need-start-debt-servicing-talks-if-war-drags-presidential-adviser-2022-06-20/
97,"N.Korea vows to boost frontline military units' action plan, strengthen war deterrent - Reuters.com","SEOUL, June 24 (Reuters) - North Korea decided to boost the action plan of its military's frontline units as its leader Kim Jong Un ordered to strengthen the country's defence capabilities to overwhe… [+516 chars]",https://www.reuters.com/world/asia-pacific/nkorea-vows-boost-frontline-military-units-action-plan-strengthen-war-deterrent-2022-06-23/
98,Duterte slams ICC prosecutor's plan to reopen Philippines drug war probe - Reuters.com,"MANILA, June 25 (Reuters) - Philippine President Rodrigo Duterte's office said on Saturday it was ""exasperated"" with International Criminal Court Prosecutor Karim Khan and his plan to resume an inves… [+1793 chars]",https://www.reuters.com/world/asia-pacific/duterte-slams-icc-prosecutors-plan-reopen-philippines-drug-war-probe-2022-06-25/
99,Mondelez to reopen war-damaged potato-chip plant outside Kyiv - Reuters.com,"NEW YORK, June 25 (Reuters) - Mondelez International Inc (MDLZ.O) plans to reopen a potato-chip plant on the outskirts of Kyiv next week which was closed following Russia's invasion of Ukraine, a spo… [+1128 chars]",https://www.reuters.com/business/retail-consumer/mondelez-reopen-war-damaged-potato-chip-plant-outside-kyiv-2022-06-25/
