,titles,content,url
0,Ukrainian kids play soccer again in bombed-out stadium - Reuters.com,"IRPIN, Ukraine, July 6 (Reuters) - Ukrainian children have started playing soccer again in a bombed-out stadium outside Kyiv, a much-needed distraction after more than four months of war.
The Champi… [+1466 chars]",https://www.reuters.com/world/europe/ukrainian-kids-play-soccer-again-bombed-out-stadium-2022-07-06/
1,Syrian refugee brings the taste of home to Gaza - Reuters.com,"GAZA, June 19 (Reuters) - Anas Qaterji fled Syria when civil war broke out in 2011 and snuck into Gaza, a land with its own history of war and poverty, where he has gained a large following among foo… [+2732 chars]",https://www.reuters.com/world/middle-east/syrian-refugee-brings-taste-home-gaza-2022-06-19/
2,NATO summit protesters play dead in front of Picasso war painting - Reuters.com,"MADRID, June 27 (Reuters) - About 30 anti-war activists protested on Monday in front of Pablo Picasso's historic Guernica painting about the horrors of war at the Reina Sofia Museum in Madrid, hours … [+1617 chars]",https://www.reuters.com/world/europe/nato-summit-protesters-play-dead-front-picasso-war-painting-2022-06-27/
3,‘The world is bloody messy’: Jacinda Ardern urges end to ‘black-and-white’ view of global conflict,"The world is bloody messy but must take a step back from polarisation and black-and-white approaches to conflict, Jacinda Ardern has said in a wide-ranging speech in which she addressed the war in Uk… [+4450 chars]",https://amp.theguardian.com/world/2022/jul/07/the-world-is-bloody-messy-jacinda-ardern-urges-end-to-black-and-white-view-of-global-conflict
4,No need for 'weapons of war' on American streets: Harris - Reuters.com,"Posted 
Vice President Kamala Harris on Tuesday renewed calls for an assault weapons ban saying, ""There is no reason we have weapons of war on the streets of America.""",https://www.reuters.com/video/watch/idOV982206072022RP1
5,"More Russian men look to avoid military service, some lawyers and rights groups say - Reuters.com","LONDON, July 8 (Reuters) - Danila Davydov said he left Russia within weeks of the Kremlin sending troops into Ukraine because he feared having to fight in a war he doesnt support.
The 22-year-old di… [+8975 chars]",https://www.reuters.com/world/europe/more-russian-men-look-avoid-military-service-some-lawyers-rights-groups-say-2022-07-08/
6,Biden calls for assault weapons ban at WH event - Reuters.com,"Posted 
07/11 President Joe Biden said the United States is ""awash in weapons of war"" on Monday and said he is determined to see assault weapons banned.",https://www.reuters.com/video/watch/ids525?now=true
7,"Australia's prime minister visits Ukraine's Kyiv region, governor says - Reuters","KYIV, July 3 (Reuters) - Australian Prime Minister Anthony Albanese visited three war-ravaged towns in Ukraine's Kyiv region, the local governor said on Sunday.
Governor Oleksiy Kuleba wrote on Tele… [+451 chars]",https://www.reuters.com/world/asia-pacific/australias-pm-visits-ukraines-kyiv-region-governor-2022-07-03/
8,How One Ukrainian CEO Uses Emotion as a Catalyst for Action,"Throughout the war in Ukraine, I have gone through a major re-assessment of my values as an entrepreneur. It's not just worrying about the future of my country; there's concern about the security of … [+4719 chars]",https://www.entrepreneur.com/article/429866
9,How the Founders of PAVe Went to War With JUUL,"As Meredith Berkman and Dorian Fuhrman, two of the co-founders of Parents Against Vaping e-cigarettes (PAVe) like to put it, ""Big Tobacco messed with the wrong moms."" Along with their friend Dina Ale… [+6967 chars]",https://www.entrepreneur.com/article/429825
10,Germany must speed up energy transition due to Ukraine war -Scholz - Reuters.com,"BERLIN, July 6 (Reuters) - Germany must implement the transition to green energy faster because of Russia's invasion of Ukraine, Chancellor Olaf Scholz said on Wednesday, adding that Russia was using… [+462 chars]",https://www.reuters.com/business/energy/germany-must-speed-up-energy-transition-due-ukraine-war-scholz-2022-07-06/
11,War looms large over G20 event as Russia meets rivals in Bali - Reuters,"NUSA DUA, Indonesia, July 8 (Reuters) - G20 foreign ministers head to a joint summit on Friday that will put some of the staunchest critics of Russia invasion of Ukraine in the same room as Moscow's … [+2493 chars]",https://www.reuters.com/world/asia-pacific/war-looms-large-over-g20-event-russia-meets-rivals-bali-2022-07-07/
12,OBITUARY Jose Eduardo dos Santos: won Angola's war and took the spoils - Reuters.com,"LUANDA, July 8 (Reuters) - José Eduardo dos Santos, who ruled Angola for nearly four decades, winning a brutal civil war and overseeing an oil-fuelled boom that did little to alleviate poverty, died … [+5310 chars]",https://www.reuters.com/world/africa/obituary-jose-eduardo-dos-santos-won-angolas-war-took-spoils-2022-07-08/
13,Moscow city councillor gets seven years' jail for anti-war comment - Reuters.com,"LONDON, July 8 (Reuters) - A Moscow district councillor was jailed for seven years on Friday for criticising Russia's invasion of Ukraine, in what a Kremlin-critical lawyer said was the first case of… [+2316 chars]",https://www.reuters.com/world/europe/moscow-city-councillor-gets-seven-years-jail-anti-war-comment-2022-07-08/
14,Duma gives first approval to laws moving Russia towards war economy - Reuters.com,"LONDON, July 5 (Reuters) - Russian lawmakers on Tuesday gave the first stamp of approval to two bills that would authorise the government to oblige businesses to supply the military with goods and th… [+2149 chars]",https://www.reuters.com/world/europe/duma-gives-first-approval-laws-moving-russia-towards-war-economy-2022-07-05/
15,Fact Check-Video said to show war in Ukraine is CGI - Reuters.com,"Social media users are sharing a video of tanks and an armoured vehicle in combat and are claiming its from the war in Ukraine. It is instead the work of a CGI artist.
Meanwhile in the Ukraine, says… [+701 chars]",https://www.reuters.com/article/factcheck-ukraine-cgi-idUSL1N2YP1K3
16,Mexican cartel urges that innocents be kept out of drug war in video message - Reuters.com,"MEXICO CITY, July 8 (Reuters) - A video claiming to be from Mexico's powerful Jalisco New Generation Cartel (CJNG) circulated on social media on Friday, urging that fighting be kept between criminal … [+1677 chars]",https://www.reuters.com/world/americas/mexican-cartel-urges-that-innocents-be-kept-out-drug-war-video-message-2022-07-08/
17,German gas grid firms amend plans to reflect Russia-Ukraine war - Reuters.com,"FRANKFURT, July 6 (Reuters) - German gas pipeline companies on Wednesday said they have amended rolling 2022-2032 investment plans for grid expansions to provide for changes to gas flows as a consequ… [+2000 chars]",https://www.reuters.com/business/energy/german-gas-grid-firms-amend-plans-reflect-russia-ukraine-war-2022-07-06/
18,TV tonight: an accident-prone infant stirs up horror and black comedy,"The Baby
9pm, Sky Atlantic
This oddball new series plays out as an intriguing if muddled mixture of horror and black comedy. Michelle De Swarte stars as Natasha, a commitment-phobic 38-year-old sti… [+2886 chars]",https://amp.theguardian.com/tv-and-radio/2022/jul/07/tv-tonight-sky-the-baby-the-undeclared-war-watch-this-evening
19,Indonesia says Ukraine war discussed in almost all bilateral G20 meetings - Reuters.com,"NUSA DUA, Indonesia, July 8 (Reuters) - The Ukraine war was discussed at almost all bilateral meetings at this week's G20 event, where some participants condemned Russia's invasion and urged an immed… [+644 chars]",https://www.reuters.com/world/indonesia-says-ukraine-war-discussed-almost-all-bilateral-g20-meetings-2022-07-08/
20,"EU has frozen 13.8 bln euros of Russian assets over Ukraine war, official says - Reuters.com","BRUSSELS, July 12 (Reuters) - The European Union has so far frozen 13.8 billion euros ($13.83 billion) worth of assets held by Russian oligarchs, other individuals and entities sanctioned for Moscow'… [+2143 chars]",https://www.reuters.com/world/europe/eu-has-frozen-138-bln-euros-russian-assets-over-ukraine-war-official-says-2022-07-12/
21,Amazon’s Paper Girls series messes with the timeline in first trailer,"Anjali Pinto/Prime Video

 

 If a new season of Stranger Things wasn’t enough ‘80s-themed sci-fi for you, Amazon has decided to release the first trailer for its upcoming Paper Girls series. The te… [+1438 chars]",https://www.theverge.com/2022/6/29/23063811/paper-girls-amazon-prime-video-trailer-release-date
22,Millie Bobby Brown to star in Netflix sci-fi movie directed by the Russo brothers,"The Electric State is due to enter production later this year
Millie Bobby Brown at the Stranger Things season 4 premiere.
Photo by Roy Rochlin/Getty Images
Stranger Things Millie Bobby Brown will… [+1836 chars]",https://www.theverge.com/2022/6/29/23187813/the-electric-state-millie-bobby-brown-russo-brothers-netflix
23,"Ukraine accuses lawmaker's aide of being Russian spy and passing on secrets for up to $4,000 a month","A Ukrainian lawmaker's aide was accused by the nation's security service of being a Russian spy and passing on intelligence for monthly payments of up to $4,000.
The unnamed man was recruited during… [+1384 chars]",https://www.businessinsider.com/ukraine-says-lawmaker-aide-russian-spy-2022-7
24,Russia-Ukraine war: What happened today (June 14),"A man examines the roof of a hospital damaged during shelling in Donetsk, eastern Ukraine, on Tuesday.
AP
As Tuesday draws to a close in Kyiv and in Moscow, here are the key developments of the day… [+2681 chars]",https://www.npr.org/2022/06/14/1104890218/russia-ukraine-war-what-happened-today-june-14
25,Russia-Ukraine war: What happened today (June 16),"From left, Romanian President Klaus Iohannis, Prime Minister of Italy Mario Draghi, Ukrainian President Volodymyr Zelenskyy, France's President Emmanuel Macron and German Chancellor Olaf Scholz atten… [+3342 chars]",https://www.npr.org/2022/06/16/1105462649/russia-ukraine-war-what-happened-today-june-16
26,Russia-Ukraine war: What happened today (June 13),"Firefighters work to extinguish an apartment building and cars burning after shelling in Donetsk, eastern Ukraine, on Monday.
Alexei Alexandrov/AP
As Monday draws to a close in Kyiv and in Moscow, … [+2885 chars]",https://www.npr.org/2022/06/13/1104546262/russia-ukraine-war-what-happened-today-june-13
27,Russia-Ukraine war: What happened today (June 23),"The Ukrainian (top) and European Union flags fly on poles in Kyiv on Thursday ahead of an EU summit in Brussels considering Ukraine's candidate status to join the 27-nation bloc.
Nariman El-Mofty/AP… [+3714 chars]",https://www.npr.org/2022/06/23/1106977208/russia-ukraine-war-what-happened-today-june-23
28,Russia-Ukraine war: What happened today (June 15),"Police inspect a crater caused by a Russian rocket attack in Pokrovsk, in eastern Ukraine's Donetsk region, on Wednesday.
Efrem Lukatsky/AP
As Wednesday draws to a close in Kyiv and in Moscow, here… [+3235 chars]",https://www.npr.org/2022/06/15/1105093912/russia-ukraine-war-what-happened-today-june-15
29,Russia-Ukraine war: What happened today (June 21),"U.S. Attorney General Merrick Garland and Ukrainian Prosecutor General Iryna Venediktova meet in Krakovets, along the Ukrainian border with Poland, on Tuesday.
Nariman El-Mofty/AP
As Tuesday draws … [+3018 chars]",https://www.npr.org/2022/06/21/1106345586/russia-ukraine-war-what-happened-today-june-21
30,Russia-Ukraine war: What happened today (July 1),"A woman cleans the area in front of a building hit by a missile strike in the Ukrainian town of Serhiivka, near Odesa, on Friday. The attack killed at least 18 people and injured 30.
Oleksandr Giman… [+1987 chars]",https://www.npr.org/2022/07/01/1109309258/russia-ukraine-war-what-happened-today-july-1
31,"Fighting entering ‘climax’ in key regions, says Ukraine","The battle for two key cities in eastern Ukraine is edging towards a fearsome climax, an adviser to the Ukrainian president, Volodymyr Zelenskiy, has said, as the war in Ukraine is set to enter its f… [+4358 chars]",https://amp.theguardian.com/world/2022/jun/23/fighting-entering-climax-in-key-regions-says-ukraine-russia-sievierodonetsk-lysychansk
32,God Of War Ragnarök Release Date Finally Confirmed,"The long-awaited release date for God Of War Ragnarök has finally been confirmed by Sony. The dadsim sequel from Santa Monica Studio will be released on November 9 this year.
In a tweet sent from th… [+1012 chars]",https://kotaku.com/god-of-war-ragnarok-santa-monica-studio-sony-ps5-1849146462
33,‘Here we are’: the Iranian photographer reframing refugees,"When photographer Ehsan Hazaveh takes portraits of former refugees in New Zealand, he does not click and walk away in some cases, the process can take 10 months, and the subject of the photograph has… [+5230 chars]",https://amp.theguardian.com/world/2022/jun/18/here-we-are-the-iranian-photographer-reframing-refugees
34,Kremlin says communication with Washington must continue - Reuters.com,"LONDON, June 15 (Reuters) - The Kremlin said on Wednesday that communication remains ""essential"" in relations with the United States, amid tensions over Russia's continuing war in Ukraine.
""Communic… [+1624 chars]",https://www.reuters.com/world/europe/kremlin-says-communication-with-washington-must-continue-2022-06-15/
35,"Both sides using heavier weapons in war in Ukraine, says Finnish president - Reuters.com","HELSINKI, June 13 (Reuters) - Finnish President Sauli Niinisto said on Monday both sides in the war in Ukraine were using heavier weapons, including in Russia's case thermobaric bombs.
""We are suppo… [+724 chars]",https://www.reuters.com/world/europe/both-sides-using-heavier-weapons-war-ukraine-says-finnish-president-2022-06-13/
36,Africa being held 'hostage': Ukraine's Zelenskiy - Reuters,"Posted 
06/21 Ukrainian President Volodymyr Zelenskiy says the war with Russia is holding African countries hostage as food prices rise for the continent.",https://www.reuters.com/video/watch/idsKMl?now=true
37,Ukraine end Hungary's World Cup playoff hopes - Reuters.com,"RZESZOW, Poland, June 28 (Reuters) - Hungary's hopes of qualifying for the 2023 Women's World Cup ended in a 2-0 defeat to war-torn Ukraine on Tuesday.
Ukraine, who are playing their games in Poland… [+1016 chars]",https://www.reuters.com/lifestyle/sports/ukraine-end-hungarys-world-cup-playoff-hopes-2022-06-28/
38,"After Roe, high stakes for Michigan ballot measure to protect abortion rights - Reuters","ST. CLAIR SHORES, Mich, July 3 (Reuters) - The latest front in the U.S. war over abortion was waged last week during an idyllic summer evening on Michigan's lakeshore.
Outside a park where kids ate … [+6065 chars]",https://www.reuters.com/world/us/after-roe-high-stakes-michigan-ballot-measure-protect-abortion-rights-2022-07-03/
39,Russia's blockade of Ukrainian grain exports is a war crime - EU's top diplomat - Reuters,"BRUSSELS, June 20 (Reuters) - Russia's blockade of the export of millions of tonnes of Ukrainian grain is a war crime, EU foreign policy chief Josep Borrell said on Monday.
""We call on Russia to deb… [+573 chars]",https://www.reuters.com/world/europe/russias-blockade-ukrainian-grain-exports-is-war-crime-eus-top-diplomat-2022-06-20/
40,Yemen begins restoration of its capital - Reuters.com,"Posted 
UNESCO-listed historic Old Sanaa is undergoing a large-scale restoration effort - after enduring years of bombings during the war. Kristy Kilburn reports.",https://www.reuters.com/video/watch/idsK6l?now=true
41,Germany discussing Ukraine security guarantees with allies - Scholz - Reuters,"BERLIN, July 3 (Reuters) - Germany is discussing security guarantees for Ukraine with its allies, in preparation for a time after the war in Ukraine, German Chancellor Scholz told broadcaster ARD on … [+565 chars]",https://www.reuters.com/world/europe/germany-discussing-ukraine-security-guarantees-with-allies-scholz-2022-07-03/
42,Russian cosmonauts celebrate capture of Ukraine's Luhansk region in space - Reuters.com,"July 4 (Reuters) - Russian cosmonauts aboard the International Space Station on Monday celebrated Russia's capture of the eastern Ukrainian region of Luhansk, a significant milestone for Moscow in th… [+1590 chars]",https://www.reuters.com/world/europe/russian-cosmonauts-celebrate-capture-ukraines-luhansk-region-space-2022-07-04/
43,Kyiv says Russia wants to destroy Ukrainian statehood and nation - Reuters,"A general view during a visit by French President Emmanuel Macron, German Chancellor Olaf Scholz, Italian Prime Minister Mario Draghi and Romanian President Klaus Iohannis to Irpin, as Russia's attac… [+1690 chars]",https://www.reuters.com/world/europe/kyiv-says-russia-wants-destroy-ukrainian-statehood-nation-2022-06-16/
44,God of War Ragnarok preorder guide: Every edition and what's in them on PS4 & PS5,"Ragnarok is coming and it's almost here. Sony Santa Monica's God of War Ragnarok will hit PS5 and PS4 this November, continuing Kratos and Atreus' story as the calamity draws near. PlayStation hasn't… [+4648 chars]",https://www.androidcentral.com/gaming/playstation/god-of-war-ragnarok-preorder-guide
45,Russia-Ukraine war: what we know on day 133 of the invasion,"Ukrainian forces have taken up new defensive lines in Donetsk, where they still control major cities, and plan to launch counter-offensives in the south of the country. The Luhansk governor, Serhiy H… [+245 chars]",https://amp.theguardian.com/world/2022/jul/06/russia-ukraine-war-what-we-know-on-day-133-of-the-invasion
46,‘Set of failures’: are Peru’s gains in the drug war a loss for the Amazon?,"Sitting on a bluff overlooking the Tambo River, the Valle Esmeralda counter-terrorist base is only accessible by helicopter or a very long hike. It is strategically located to have a birds eye view o… [+4694 chars]",https://amp.theguardian.com/world/2022/jul/06/peru-drug-war-gain-amazon-loss
47,Russia-Ukraine war update: what we know on day 137 of the invasion,<li>Canada has granted a sanctions exemption to allow a repaired Russian turbine to be sent back to Germany for the Nord Stream 1 gas pipeline. The Canadian government said the time-limited and revoc… [+3270 chars],https://amp.theguardian.com/world/2022/jul/10/russia-ukraine-war-update-what-we-know-on-day-137-of-the-invasion
48,Russia-Ukraine war update: what we know on day 134 of the invasion,"Resistance remains ongoing in villages around Lysychansk, where 15,000 civilians remain, according to Luhansks governor, Serhiy Haidai. On Telegram, Haidai said: Todays videos from Lysychansk are pai… [+131 chars]",https://amp.theguardian.com/world/2022/jul/07/russia-ukraine-war-update-what-we-know-on-day-134-of-the-invasion
49,Russia-Ukraine war update: what we know on day 139 of the invasion,"Iran is planning to supply Russia with hundreds of weapons-capable drones for use in Ukraine, according to a top US official. Jake Sullivan, the White House national security adviser, said: The Irani… [+283 chars]",https://amp.theguardian.com/world/2022/jul/12/russia-ukraine-war-update-what-we-know-on-day-139-of-the-invasion
50,Not 'business as usual' for G20 foreign ministers meeting in Bali - Reuters.com,"July 6 (Reuters) - G20 foreign ministers travel to the resort island of Bali this week for a meeting that will be overshadowed by the war in Ukraine, with Russia's attendance creating rifts in the bl… [+4338 chars]",https://www.reuters.com/world/asia-pacific/not-business-usual-g20-foreign-ministers-meeting-bali-2022-07-06/
51,Russia warns humanity at risk if West seeks to punish it over Ukraine - Reuters.com,"KYIV/KRAMATORSK, July 7 (Reuters) - Former Russian President Dmitry Medvedev said attempts by the West to punish a nuclear power such as Russia for the war in Ukraine risked endangering humanity, as … [+5714 chars]",https://www.reuters.com/world/russia-warns-humanity-risk-if-west-seeks-punish-it-over-ukraine-2022-07-07/
52,"Russia not allowed to use G20 meeting as platform, says German foreign minister - Reuters.com","BERLIN, July 6 (Reuters) - German Foreign Minister Annalena Baerbock said ahead of her trip to Indonesia that Russia must not be allowed to use the G20 meeting this week as a platform given its war i… [+458 chars]",https://www.reuters.com/world/europe/russia-not-allowed-use-g20-meeting-platform-says-german-foreign-minister-2022-07-06/
53,Russia shells Ukraine's Donetsk after seizing Luhansk - Reuters,"Posted 
07/05 Russian forces struck targets across Ukraine's eastern Donetsk region on Tuesday to prepare the path for an expected armored thrust to try to take more territory as the five-month-old … [+23 chars]",https://www.reuters.com/video/watch/ids5cA?now=true
54,Russia's Medvedev warns United States: messing with a nuclear power is folly - Reuters.com,"LONDON, July 6 (Reuters) - Former Russian President Dmitry Medvedev told the United States on Wednesday that attempts by the West to punish a nuclear power such as Russia for the war in Ukraine riske… [+2142 chars]",https://www.reuters.com/world/russias-medvedev-warns-united-states-messing-with-nuclear-power-is-folly-2022-07-06/
55,"Why India ramped up Russian oil imports, easing pressure on Moscow - Reuters.com","NEW DELHI, July 8 (Reuters) - Since the start of the war in Ukraine, the United States and its allies have leaned on countries to buy less Russian oil in a bid to punish Moscow for its aggression.
I… [+8424 chars]",https://www.reuters.com/world/india/why-india-ramped-up-russian-oil-imports-easing-pressure-moscow-2022-07-08/
56,"Treasury's Yellen, Japan's Suzuki to discuss weak yen, more sanctions on Russia - Reuters.com","TOKYO, July 12 (Reuters) - U.S. Treasury Secretary Janet Yellen will discuss ways to further strengthen Western sanctions against Russia over its war in Ukraine when she meets with Japanese Finance M… [+2030 chars]",https://www.reuters.com/world/treasurys-yellen-japans-suzuki-discuss-weak-yen-more-sanctions-russia-2022-07-11/
57,Biden calls for assault weapons ban at gun safety event - Reuters.com,"Posted 
President Joe Biden said the United States is ""awash in weapons of war"" on Monday and said he is determined to see assault weapons banned. This report produced by Jillian Kitchener.",https://www.reuters.com/video/watch/idOV113911072022RP1
58,US Treasury Secretary Yellen met Japan's top central banker - Treasury - Reuters.com,"TOKYO, July 12 (Reuters) - U.S. Treasury Secretary Janet Yellen met with Bank of Japan Governor Haruhiko Kuroda on Tuesday, the Treasury Department said, as both countries grapple with mounting econo… [+578 chars]",https://www.reuters.com/world/us-treasury-secretary-yellen-met-japans-top-central-banker-treasury-2022-07-12/
59,German industrial output rises less than expected in May - Reuters,"BERLIN, July 7 (Reuters) - German industrial production rose less than expected in May as supply chains problems caused by the war in Ukraine and pandemic-related lockdowns in China make it difficult… [+409 chars]",https://www.reuters.com/markets/europe/german-industrial-output-rises-less-than-expected-may-2022-07-07/
60,U.S.-Saudi ties through good times and bad - Reuters.com,"July 12 (Reuters) - U.S. President Joe Biden visits Saudi Arabia at a rocky time in relations, which have been tested by the killing of Washington Post journalist Jamal Khashoggi and the Yemen war.
… [+5179 chars]",https://www.reuters.com/world/us-saudi-ties-through-good-times-bad-2022-07-12/
61,Russia-Ukraine war update: what we know on day 135 of the invasion,"The Russian president, Vladimir Putin, warned Moscow had barely started its campaign in Ukraine and dared the west to try to defeat it on the battlefield. Putin said the prospects for any negotiation… [+262 chars]",https://amp.theguardian.com/world/2022/jul/08/russia-ukraine-war-update-what-we-know-on-day-135-of-the-invasion
62,Russia-Ukraine war: Ukrainian soldiers arrive in UK for training; battle to retake Kherson – latest updates,"The Ukrainian soldiers being trained in the UK have met UK defence secretary Ben Wallace, Press Association reports, at the start of their training, which is expected to last several weeks.
Wallace … [+818 chars]",https://www.theguardian.com/world/live/2022/jul/09/russia-ukraine-war-ukrainian-soldiers-arrive-in-uk-for-training-battle-to-retake-kherson-latest-updates
63,Global hunger toll soars by 150 million as Covid and Ukraine war make their mark,"The number of people going hungry in the world has risen by 150 million since the start of the Covid pandemic, the UN has said, warning that the food crisis sparked by Russias invasion of Ukraine ris… [+3979 chars]",https://amp.theguardian.com/global-development/2022/jul/06/global-hunger-toll-soars-by-150-million-as-covid-and-ukraine-war-make-their-mark
64,Opinion: She spoke the truth of 'that awful day',"Sign up to get this weekly column as a newsletter. We're looking back at the strongest, smartest opinion takes of the week from CNN and other outlets.
 (CNN)It was a ""war scene,"" like something ""out… [+13710 chars]",https://www.cnn.com/2022/06/12/opinions/truth-of-that-awful-day-column-galant/index.html
65,Berlin to again deploy troops in Bosnia 10 years after withdrawal - Reuters.com,"BERLIN, July 8 (Reuters) - Germany will deploy troops with the EU's peacekeeping mission in Bosnia for the first time in a decade as concerns mount about instability from the Ukraine war spilling ove… [+1586 chars]",https://www.reuters.com/world/europe/berlin-again-deploy-troops-bosnia-10-years-after-withdrawal-2022-07-08/
